id;jhi_type;jhi_date;place;hotel;person_name_hash;person_document_hash;phone_number_hash;description
1;THEFT;2019-05-06T19:02:43;Savings Account Dam;Practical Fresh Pants;Metal deposit;Producer;Implementation Electronics Officer;methodology Albania
2;THEFT;2019-05-07T04:09:40;Gorgeous Frozen Pants;Common;Savings Account syndicate Planner;Refined Rubber Chicken Table;Automotive;Planner cross-platform access
3;THEFT;2019-05-07T07:58:24;Bahamian Dollar Investment Account;Games Regional Digitized;copy convergence;Mayotte;Industrial;connect Markets Chief
4;THEFT;2019-05-07T00:04:02;Aruba;software scale interactive;Louisiana Specialist Home Loan Account;Plastic;Car Industrial deliverables;orange Books
5;THEFT;2019-05-06T23:12:54;Identity;Frozen IB;Highway Ergonomic;moratorium moratorium;New York tangible Mississippi;Frozen bus
6;THEFT;2019-05-07T12:47:15;system Small;Intelligent Outdoors;Harbor Montana;Corporate Phased relationships;white Brand Money Market Account;Salad Web virtual
7;THEFT;2019-05-07T08:30:55;e-business;Ghana back-end National;Direct;Profit-focused;Jewelery cutting-edge;Games
8;THEFT;2019-05-06T21:08:22;encompassing;Directives;sky blue;Kenyan Shilling robust;Versatile Exclusive Moroccan Dirham;capability zero tolerance Computers
9;THEFT;2019-05-07T12:57:52;ubiquitous;Public-key Granite;Way Dominican Republic;Bulgarian Lev navigate;Re-contextualized;web-enabled invoice withdrawal
10;THEFT;2019-05-07T10:08:26;Bedfordshire;Refined Rubber Gloves Algerian Dinar Clothing;open-source turn-key;Sausages;disintermediate Cambridgeshire hacking;bricks-and-clicks Concrete Global
